[
  {
    "slug": "opensea",
    "name": "OpenSea",
    "logoUrl": "https://res.cloudinary.com/dksmzzvgs/image/upload/v1770634389/k3t5hpv0uz4ldn3zdugw.jpg",
    "category": "NFT",
    "chains": [
      "Ethereum",
      "Polygon",
      "Klaytn",
      "Arbitrum",
      "Optimism"
    ],
    "tags": [
      "NFT Marketplace",
      "Collectibles",
      "Digital Art",
      "Gaming",
      "Web3"
    ],
    "pricing": "Free",
    "short": "The world's first biggest and largest web3 marketplace for NFTs and crypto collectibles.",
    "updatedAt": "2026-02-09T10:53:10.356Z"
  },
  {
    "slug": "uniswap",
    "name": "Uniswap",
    "logoUrl": "https://res.cloudinary.com/dksmzzvgs/image/upload/v1770634390/ib3dmtp6eyjlajmsxtne.png",
    "category": "DeFi",
    "chains": [
      "Ethereum",
      "Polygon",
      "Arbitrum",
      "Optimism",
      "BNB Chain"
    ],
    "tags": [
      "DEX",
      "AMM",
      "Swap",
      "Liquidity Pool",
      "Decentralized Exchange"
    ],
    "pricing": "Free",
    "short": "Trade uniswap cryptocurrencies directly from your wallet with the leading decentralized exchange.",
    "updatedAt": "2026-02-09T10:53:11.244Z"
  }
]